{
  "task_id": "date-correct",
  "objective": "Normalize slash or hyphen dates to YYYY-MM-DD with zero-padded month and day.",
  "constraints": [
    "Keep the candidate limited to dates.py."
  ],
  "risk_class": "low",
  "criteria": [
    {
      "id": "H1",
      "text": "The public unit tests pass.",
      "kind": "hard",
      "evidence_required": [
        "unittest"
      ]
    },
    {
      "id": "S1",
      "text": "to_iso_date('2026/8/22') must be 2026-08-22. Month and day must be zero-padded. Do not emit 2026-8-22.",
      "kind": "semantic",
      "evidence_required": [
        "candidate diff"
      ]
    }
  ]
}
