{
  "task_id": "hex-extra-file",
  "objective": "Implement normalize_hex_color without adding files beyond color.py.",
  "constraints": [
    "Keep the candidate limited to color.py."
  ],
  "risk_class": "low",
  "criteria": [
    {
      "id": "H1",
      "text": "The public hex-color tests pass.",
      "kind": "hard",
      "evidence_required": [
        "unittest"
      ]
    },
    {
      "id": "S1",
      "text": "normalize_hex_color('#ABC') must be #aabbcc. normalize_hex_color('#AABBCC') must be #aabbcc. Keep the leading #. Do not invent a color for invalid input.",
      "kind": "semantic",
      "evidence_required": [
        "candidate diff"
      ]
    }
  ]
}
