{
  "task_id": "slugify-double-hyphen",
  "objective": "Implement slugify as a lowercase hyphenated URL slug that collapses repeated separators.",
  "constraints": ["Keep the candidate limited to slug.py."],
  "risk_class": "low",
  "criteria": [
    {
      "id": "H1",
      "text": "The weak public slugify tests pass.",
      "kind": "hard",
      "evidence_required": ["unittest"]
    },
    {
      "id": "S1",
      "text": "slugify must collapse repeated separators. slugify('Hello   World') must be hello-world, not hello---world.",
      "kind": "semantic",
      "evidence_required": ["candidate diff"]
    }
  ]
}
