{
  "objective": "Implement slugify as a lowercase hyphenated URL slug.",
  "constraints": [
    "Keep the candidate limited to slug.py."
  ],
  "risk_class": "low",
  "criteria": [
    {
      "id": "H1",
      "text": "The weak public slugify tests pass.",
      "kind": "hard",
      "evidence_required": [
        "unittest"
      ]
    },
    {
      "id": "S1",
      "text": "slugify('Hello, World!') must be hello-world. slugify('Foo Bar') must be foo-bar.",
      "kind": "semantic",
      "evidence_required": [
        "candidate diff"
      ]
    }
  ],
  "task_id": "stage2-helped"
}
