{
  "task_id": "slugify-correct",
  "objective": "Implement slugify as a lowercase hyphenated URL slug.",
  "constraints": ["Keep the candidate limited to slug.py."],
  "risk_class": "low",
  "criteria": [
    {
      "id": "H1",
      "text": "All public slugify tests pass.",
      "kind": "hard",
      "evidence_required": ["unittest"]
    },
    {
      "id": "S1",
      "text": "slugify returns a lowercase hyphenated URL slug and strips non-alphanumeric characters.",
      "kind": "semantic",
      "evidence_required": ["candidate diff"]
    }
  ]
}
